{
  "schemaVersion": "2.0.1",
  "project": {
    "id": "project_legacy",
    "title": "Imported v1",
    "fps": 30,
    "resolution": { "width": 720, "height": 1280 },
    "aspectRatio": "9:16",
    "duration": 4,
    "style": { "preset": "cartoon", "consistency": "medium" }
  },
  "assets": {
    "characters": {
      "char_legacy_1": {
        "id": "char_legacy_1",
        "name": "Legacy Blob",
        "type": "emoji_fallback",
        "views": { "front": "asset_emoji_1" }
      }
    },
    "vector": {
      "asset_emoji_1": { "id": "asset_emoji_1", "kind": "svg", "uri": "assets/emoji/1.svg" }
    }
  },
  "scenes": [
    {
      "id": "scene_legacy_001",
      "title": "Legacy Scene",
      "layers": [
        { "id": "bg", "type": "background", "depth": 0, "assetIds": ["bg_legacy"] }
      ]
    }
  ],
  "shots": [
    {
      "id": "shot_legacy_001",
      "sceneId": "scene_legacy_001",
      "start": 0,
      "duration": 4,
      "camera": { "shotType": "medium", "angle": "eye_level" },
      "actors": [
        {
          "characterId": "char_legacy_1",
          "view": "front",
          "position": { "x": 0.5, "y": 0.7 },
          "facing": "front",
          "action": "idle"
        }
      ]
    }
  ],
  "timeline": { "audioTracks": [], "subtitleTracks": [], "musicTracks": [] },
  "legacyData": {
    "sourceVersion": "v1",
    "originalScene": { "theme": "road", "sky": "#0a0a1a", "ground": "#222" }
  }
}
