{
  "schemaVersion": "2.0.0",
  "project": {
    "id": "project_mg",
    "title": "Explainer",
    "fps": 30,
    "resolution": { "width": 1080, "height": 1080 },
    "aspectRatio": "1:1",
    "duration": 5,
    "style": { "preset": "flat_motion" }
  },
  "assets": {
    "characters": {},
    "vector": {},
    "graphics": {
      "logo_mark": { "id": "logo_mark", "kind": "svg", "uri": "assets/graphics/logo.svg", "width": 256, "height": 256 }
    }
  },
  "scenes": [
    {
      "id": "scene_bg",
      "title": "Flat Background",
      "layers": [
        { "id": "bg", "type": "background", "depth": 0, "assetIds": ["bg_flat"] }
      ]
    }
  ],
  "shots": [
    {
      "id": "shot_001",
      "sceneId": "scene_bg",
      "start": 0,
      "duration": 5,
      "camera": { "shotType": "medium", "angle": "eye_level" },
      "graphics": [
        { "id": "g_title", "type": "title_card", "text": "How it works", "start": 0.2, "duration": 2.0, "animation": "fade_up" },
        { "id": "g_counter", "type": "counter", "start": 2.4, "duration": 2.0, "text": "42", "position": { "x": 0.5, "y": 0.5 } }
      ]
    }
  ],
  "timeline": { "audioTracks": [], "subtitleTracks": [], "musicTracks": [] }
}